{
  "componentId": "mycomponent123",
  "componentDescription": "Generic component",
  "parentAssetId": "myasset123",
  "secondaryAttributes": [
    {
      "name": "colour",
      "value": "Pink",
      "category": "Appearance",
      "dataType": "string"
    }
  ],
  "assets": [],
  "subcomponents": []
}
